state,district,address,lat,lng
Selangor,Klang,"AEON Bukit Tinggi Lot G28, Ground Floor,AEON Mall Bukit Tinggi, No 1, Persiaran Batu Nilam 1/Ks6, Bandar Bukit Tinggi 2 Klang Selangor",2.9935685,101.4443686
Kelantan,Tumpat,"AEON Kota Bharu Lot G37, Ground Floor, AEON Mall Kota Bharu, Kampung Sireh, Jalan Jambatan Sultan Yahya Petra, Kota Bharu Kelantan",6.1164492,102.2282606
Melaka,Melaka Tengah,"Ayer Keroh Melaka No 1, Ground Floor, Jalan Komersial Takh 2, Taman Air Keroh Height Malacca Malacca",2.259551,102.2860905
Selangor,Ulu Langat,"Ampang Point No.51, Jalan Mamanda 9 Ampang Point Ampang Selangor",3.1583266,101.7534938
W.P. Kuala Lumpur,W.P. Kuala Lumpur,"Plaza Arkadia A-G-11 (Block A), Plaza Arkadia, No. 3, Jalan Intisari Perdana Desa Parkcity Federal Territories Kuala Lumpur",3.1855877,101.6349096
Selangor,Petaling,"AEON Shah Alam Lot G22, Ground Floor Aeon Mall Shah Alam No. 1, Jalan Akuatik 13/64, Seksyen 13 Shah Alam Selangor",3.0761611,101.5486938
Johor,Johor Bahru,"City Square Lot J1-01 & JK1-16, Level 1 Johore Bahru City Square, 108 Jalan Wong Ah Fook Johor Bahru Johor",1.462723945,103.7632381
Pulau Pinang,Barat Daya,"Golden Triangle 2 No. 35-1-18 & 19, Golden Triangle 2, Jalan Dato Ismail Hashim Bayan Lepas Penang",5.32965312,100.2748709
Johor,Johor Bahru,"KSL City G-03&03A, KSL CITY No. 33 Jalan Seladang Taman Abad Johor Bahru Johor",1.486076191,103.7623898
W.P. Kuala Lumpur,W.P. Kuala Lumpur,"Lot 10 F27 & F28, First Floor Lot 10 Shopping Centre 50 Jalan Sultan Ismail Kuala Lumpur Federal Territories Kuala Lumpur",3.1467810960000002,101.7115865
Pulau Pinang,Barat Daya,"The Promenade 5-G-13 & 13A ,The Promenade, 5 Persiaran Mahsuri Bandar Bayan Baru Penang",5.331257936,100.2833337
W.P. Kuala Lumpur,W.P. Kuala Lumpur,"Quill City Mall Lot G-31 & 32, Ground Floor, Quill City Mall, No.1018, Jalan Sultan Ismail Kuala Lumpur Federal Territories Kuala Lumpur",3.160096716,101.7000884
Johor,Johor Bahru,"R&F Mall  GF-111,112,113, Mercu 1 Jalan Tanjung Puteri 1 R&F Tanjung Puteri Johor Bahru Johor",1.459024368,103.7694707
Selangor,Petaling,"SS2 No. 50G & 50M, Jalan SS2/67 Petaling Jaya Selangor",3.120107824,101.6220432
Pahang,Kuantan,"East Coast Mall 2 Lot GF-19 & 19-AL, Ground Floor, Kuantan City Mall, 1, Jalan Putra Square 6, Putra Square,",3.818684003,103.3262857
Selangor,Kuala Selangor,"Eco Grandeur Drive Thru Jalan Eco Grandeur 1/5, Eco Grandeur",3.229345841,101.4566512
Pulau Pinang,Timur Laut,"Tree Square Mall 88-G-01 & 02, Jalan Sungai Kelian,",5.463589457,100.283741
Selangor,Kuala Langat,"Eco Sanctuary Drive Thru Lot D-G-09, Se. Ruang Square, Eco Sanctuary,",2.947235369,101.5435934
Kedah,Kota Setar,Aman Central Mall  Lot G-62A & G-73A Aman Central No. 1 Lebuhraya Darulaman Alor Setar Kedah,6.125050122,100.3668115
Pulau Pinang,Timur Laut,"E-Gate 1-01-06, E-Gate Commercial Centre, Lebuh Tunku Kudin 2 Penang Penang",5.375986,100.3153234
Pulau Pinang,Timur Laut,"Karpal Singh Drive 29C-1-7 Maritime, Persiaran Karpal Singh Jelutong Penang",5.3983016,100.3291549
Pulau Pinang,Timur Laut,"Straits Quay Unit No: 3H-G-3 Ground Floor Quay 1, Straits Quay Jalan Seri Tanjung Pinang, Tanjong Tokong Georgetown Penang",5.454686,100.3129628
Selangor,Klang,"Canary Garden KSL Esplanade Mall Canary Garden KSL Esplanade Mall (CGK) Lot No G001 & G001 (E), Ground Floor, KSL Esplanade Mall. No 1 Persiaran Bestari 2/KS09, Bandar Bestari",2.9596903900695897,101.4668102800536
Pulau Pinang,Timur Laut,"Lotus's Tanjung Pinang Lot G20 & G21, Lotus’s Tanjung Pinang, No. 1, Jalan Seri Tanjung Pinang, Tanjong Tokong,",5.458937199999999,100.3087485
Selangor,Ulu Langat,"Savanna Boulevard Southville Lot E4-G-14, Savanna Boulevard Retail Shop, Southville City, Bandar Baru Lembah Selatan,",2.9039323311043663,101.7647171101592
Selangor,Petaling,"CB&TL Elmina Lakeside Mall: Lot GF-20, Ground Floor, Elmina Lakeside Mall, 40160 Shah Alam, Selangor",3.1805805499157507,101.50875905306502
Sarawak,Kuching,"CB&TL Kuching International Airport 900A, 93250 Kuching, Sarawak",1.6596514808056524,110.36067231802669
Sabah,Kota Kinabalu,"11, Jalan Damai, Luyang Commercial Centre, 88300 Kota Kinabalu, Sabah",5.964510525376408,116.0870764377951
